{
  "schema_version": "0.4.1",
  "skill_binding": {
    "load_mode": "transient_github",
    "entrypoint": "zycdev/chatgpt-ppt-skill/CHATGPT.md",
    "declared_version": "0.4.1",
    "requested_ref": "main",
    "resolved_commit": "<RESOLVED_COMMIT_SHA>",
    "freeze_policy": "session_snapshot",
    "loaded_at": null
  },
  "deck": {
    "name": "example_deck",
    "goal": "Explain a research project clearly and visually",
    "audience": "expert review panel",
    "language": "zh-CN",
    "target_slide_count": 10,
    "approval_mode": "interactive",
    "qa_mode": "standard",
    "max_corrective_attempts": 2,
    "source_grounding_required": true,
    "status": "sample"
  },
  "outline": {
    "approved": true,
    "path": "outline.md",
    "content_lock_applied": true
  },
  "style": {
    "approved": true,
    "source_type": "built_in",
    "source_name": "科研答辩风",
    "visual_spec_path": "visual_spec.md",
    "text_repairability_required": true,
    "constraint_overrides": []
  },
  "sample": {
    "slide_number": 4,
    "approved": false,
    "path": null,
    "primary_visual_anchor": false,
    "preflight_passed": false,
    "attempt_count": 0,
    "issues": [],
    "waivers": []
  },
  "slides": {
    "1": {
      "title": "Title",
      "status": "planned",
      "path": null,
      "prompt_path": "prompts/slide_01.md",
      "attempt_count": 0,
      "issues": [],
      "waivers": [],
      "source_refs": [
        "source document: cover / project title"
      ],
      "notes": ""
    },
    "2": {
      "title": "Context",
      "status": "planned",
      "path": null,
      "prompt_path": "prompts/slide_02.md",
      "attempt_count": 0,
      "issues": [],
      "waivers": [],
      "source_refs": [
        "source document: background section"
      ],
      "notes": ""
    },
    "3": {
      "title": "Research question",
      "status": "planned",
      "path": null,
      "prompt_path": "prompts/slide_03.md",
      "attempt_count": 0,
      "issues": [],
      "waivers": [],
      "source_refs": [
        "source document: research objectives/questions"
      ],
      "notes": ""
    },
    "4": {
      "title": "Core framework",
      "status": "planned",
      "path": null,
      "prompt_path": "prompts/slide_04.md",
      "attempt_count": 0,
      "issues": [],
      "waivers": [],
      "source_refs": [
        "source document: technical route"
      ],
      "notes": "Representative sample candidate."
    }
  },
  "output": {
    "pptx_path": null,
    "speech_path": null,
    "notes_embedded": false,
    "validation_passed": false
  }
}
